id,title,description,rank,frequency,est.
1,International Conference on Data Engineering,Conference on Data Engineering,1,annual,1984
2,SIGMOD,ACM SIGMOD Conference,1,,1975
3,ACM SIGMOD,,1,annual,1975
4,ICDE,International Conference on Data Engineering,,yearly,
5,CIDR,Conference on Innovative Data Systems Research,,biennial,2002
6,Conference on Innovative Data Systems Research,,2,biyearly,2002
7,Very Large Databases,VLDB,,annual,1975
8,VLDB,International Conference on Very Large Databases,1,yearly,1975
